{
  "schema": "agentic-os.pursue.result/v1",
  "capability": "agentic-os.pursue",
  "status": "completed",
  "readiness": {
    "knowledge": {
      "status": "ready",
      "observed_at": "2026-07-23T08:00:00Z",
      "capabilities": [
        "knowledge-system-interface/v1",
        "snapshot-token-validation"
      ],
      "reasons": ["communication-strategy:absent"]
    },
    "career": {
      "status": "ready",
      "observed_at": "2026-07-23T08:00:01Z",
      "capabilities": [
        "career.profile.check/v1",
        "career.profile.reconcile/v1",
        "career.opportunity.select-related/v1",
        "career.opportunity.advance/v1",
        "career.opportunity.review-waiting/v1"
      ],
      "reasons": []
    }
  },
  "personalization": "generic-defaults",
  "selected": ["career-opportunity:142"],
  "suppressed": [
    {
      "code": "related-opportunity-suppressed",
      "message": "A related alternative was suppressed by the native selector.",
      "reference": "career-opportunity:143"
    }
  ],
  "research_blocked": [],
  "plans": ["career-plan:142"],
  "draft_packs": ["career-draft-pack:142"],
  "wait_recommendations": [
    {
      "code": "continue-waiting",
      "message": "Native wait review found no confirmed evidence requiring a new route.",
      "reference": "career-opportunity:121"
    }
  ],
  "safe_advances": [
    {
      "code": "draft-recorded",
      "message": "Career recorded only the safe internal projection that a draft exists.",
      "reference": "career-opportunity:142"
    }
  ],
  "evidence_sufficiency": {
    "code": "insufficient-personal-evidence",
    "message": "Career used generic planning priors without asserting a personal channel outcome."
  },
  "capacity_shortfall": 0,
  "reconciliation": {
    "code": "verified",
    "message": "Career verified the fresh profile projection before pursuit."
  },
  "required_approvals": [
    {
      "code": "application-submission",
      "message": "The user must review and explicitly approve any application submission.",
      "reference": "career-draft-pack:142"
    }
  ],
  "proposed_captures": [],
  "blocked_actions": []
}
